{
  "version": 1,
  "conversation": {
    "language": "en",
    "publication_language": "en",
    "decision_tone": "concise"
  },
  "interaction": {
    "max_question_chars": 0,
    "command_preference": "slash"
  },
  "session_start": { "priority": "unselected" },
  "surfaces": ["claude-code", "codex", "kiro-cli", "claude-desktop"]
}
